id,title,clean_title,category,year,author,advisor,url,abstract,cluster
658,RANCANG BANGUN SISTEM INFORMASI PEMBAYARAN SPP BERBASIS WEBSITE MENGGUNAKAN METODE MODIFIED WATERFALL (STUDI KASUS : SMA NEGERI 1 LUMBAN JULU),rancang bangun sistem informasi pembayaran spp berbasis website menggunakan metode modified waterfall studi kasus sma negeri 1 lumban julu,Teknik Informatika,2025,Uni Andriani Sitohang,"Meida Cahyo Untoro, S.Kom., M.Kom",https://repo.itera.ac.id/depan/submission/SB2512220003,"Perkembangan teknologi informasi mendorong instansi pendidikan untuk mengoptimalkan proses administrasi secara digital, termasuk pembayaran Sumbangan Pembinaan Pendidikan (SPP) di SMA Negeri 1 Lumban Julu yang masih dilakukan secara manual sehingga menimbulkan permasalahan seperti antrean pembayaran, kesalahan pencatatan, hilangnya bukti pembayaran dan laporan keuangan masih dibuku besar. Penelitian ini bertujuan untuk merancang dan membangun sistem informasi pembayaran SPP berbasis website menggunakan metode modified waterfall yang meliputi tahap analisis kebutuhan, perancangan, implementasi, pengujian, deployment dan maintenance. Sistem yang dikembangkan menyediakan fitur pengelolaan data kelas, data tahun ajaran, data siswa, data pengeluaran, transaksi melalui payment gateway dan laporan pembayaran secara otomatis. Pengujian dilakukan menggunakan Black Box Testing dan System Usability Scale (SUS), dengan hasil skor SUS sebesar 70.66 yang termasuk kategori baik. Berdasarkan hasil tersebut, sistem mampu meningkatkan efisiensi dan akurasi administrasi pembayaran SPP meskipun masih diperlukan pengembangan lanjutan terkait penyimpanan bukti pembayaran digital secara mandiri untuk mengurangi risiko kehilangan bukti transaksi. Kata kunci: Sistem Informasi, Pembayaran SPP, Website, Payment Gateway, Modified Waterfall, Black Box Testing, System Usability Scale (SUS).",9
663,Rancang Bangun Sistem Informasi Pengajuan Izin Belajar Dan Tugas Belajar ASN Berbasis Website Dengan Metode Modified Waterfall (Studi Kasus : RSUD JEND AHMAD YANI METRO),rancang bangun sistem informasi pengajuan izin belajar dan tugas belajar asn berbasis website dengan metode modified waterfall studi kasus rsud jend ahmad yani metro,Teknik Informatika,2023,Deo Alif Alfitrah,"Andre Febrianto S.Kom., M.Eng",https://repo.itera.ac.id/depan/submission/SB2111300001,"Sistem Informasi Pengajuan Izin belajar dan Tugas belajar ASN berbasis website merupakan suatu aplikasi yang dirancang dan dikembangkan untuk mempermudah proses pengajuan Izin belajar dan Tugas belajar untuk Aparatur Sipil Negara (ASN) di RSUD Jend. Ahmad Yani Metro. Tahapan pengembangan yang dipergunakan pada tahapan pembuatan sistem ini adalah tahapan metode Modified Waterfall. Tujuan penelitian ini yaitu untuk membuat proses pengajuan yang efisiensi dan efektivitas untuk ASN serta mengurangi potensi kesalahan dan keterlambatan dalam pengelolaan data. Penelitian ini memiliki hasil yaitu Sistem Informasi Pengajuan Izin belajar dan Tugas belajar ASN berbasis website yang telah berhasil dikembangkan dan diimplementasikan di RSUD Jend. Ahmad Yani Metro. Sistem ini memungkinkan ASN untuk mengajukan Izin belajar dan Tugas belajar secara online melalui website. Proses pengajuan dan persetujuan Izin belajar dan Tugas belajar dapat dilakukan secara lebih efisien dan transparan. Selain itu, sistem ini juga menyediakan fitur manajemen data ASN, sehingga memudahkan pengelolaan data ASN yang terkaitan dengan izin belajar dan tugas belajar. Penggunaan metode Modified Waterfall dalam pengembangan sistem informasi ini memberikan hasil Usability 95,3 yang artinya sudah masuk dalam kategori best imaginable. Sistem Informasi Pengajuan Izin belajar dan Tugas belajar ASN berbasis website ini diharapkan dapat meningkatkan kinerja pengajuan Izin belajar dan Tugas belajar ASN di RSUD Jend. Ahmad Yani Metro serta memberikan manfaat dalam pengelolaan data ASN yang lebih efisien dan efektif.",9
675,RANCANG BANGUN SISTEM INFORMASI PROFIL DAN PENILAIAN KINERJA GURU MENGGUNAKAN METODE RAPID APPLICATION DEVELOPMENT (STUDI KASUS: YAYASAN BAITUL MUSLIM),rancang bangun sistem informasi profil dan penilaian kinerja guru menggunakan metode rapid application development studi kasus yayasan baitul muslim,Teknik Informatika,2025,Ahmad Fathur Rohman,"Aidil Afriansyah, S.Kom., M.Kom",https://repo.itera.ac.id/depan/submission/SB2602180033,"Perkembangan teknologi informasi yang pesat telah membawa perubahan signifikan dalam berbagai aspek kehidupan. Transformasi digital menjadi kebutuhan penting bagi organisasi pendidikan, termasuk Yayasan Baitul Muslim Lampung Timur, untuk memudahkan pengelolaan informasi dan penilaian kinerja guru. Yayasan Baitul Muslim masih menyebarkan informasi melalui WhatsApp dan Facebook yang sering tidak lengkap serta tidak pernah diperbarui, sementara proses penilaian kinerja guru dilakukan secara manual menggunakan berkas fisik. Kondisi ini menimbulkan keterlambatan, potensi kesalahan input, duplikasi data, dan kesulitan pelacakan dokumen, sehingga menghambat objektivitas penilaian, Penelitian ini bertujuan merancang Sistem Informasi Profil dan Penilaian Kinerja Guru berbasis website dengan menerapkan metode Rapid Application Development (RAD). Metode RAD dipilih karena mendukung pengembangan cepat dan adaptif melalui requirements planning, user design, construction, dan cutover. Sistem dibangun dengan ReactJS dan PostgreSQL. Kualitas fungsional diuji dengan Black Box Testing pada 42 skenario menghasilkan tingkat keberhasilan 100% membuktikan fungsionalitas sesuai spesifikasi, sedangkan evaluasi System Usability Scale (SUS) melibatkan 71 responden dan mendapatkan nilai A untuk sistem profil dan nilai B untuk sistem kinerja guru yang menunjukkan penerimaan pengguna yang baik. Secara keseluruhan, sistem berhasil mendigitalisasi pengelolaan informasi dan penilaian kinerja guru secara lebih cepat, konsisten, dan mudah ditelusuri.",9
676,"Rancang Bangun Sistem Informasi Profil Dan PPDB Online Berbasis Web Dengan Menggunakan Metode Waterfall (Studi Kasus: SMPN 27 Seluma, Bengkulu)",rancang bangun sistem informasi profil dan ppdb online berbasis web dengan menggunakan metode waterfall studi kasus smpn 27 seluma bengkulu,Teknik Informatika,2024,ALGA FIKY,"Eko Dwi Nugroho, S. Kom., M.Cs.",https://repo.itera.ac.id/depan/submission/SB2409100086,"Teknologi informasi dinilai mampu meningkatkan kinerja dan produktivitas kerja dari manusia serta membuat hampir semua kegiatan dapat dilaksanakan dengan fleksibel dan efisien. Namun, perkembangan teknologi informasi yang telah berkembang pesat dalam dunia pendidikan ini ternyata belum berjalan secara merata di tiap-tiap sekolah di provinsi Bengkulu khususnya di SMPN 27 Seluma. Proses penerimaan peserta didik baru SMPN 27 Seluma masih dilakukan secara manual yaitu dengan mendaftarkan diri langsung ke sekolah dengan mengisi kertas formulir, serta penyampaian informasi terkait dengan SMPN 27 Seluma masih menggunakan cara konvensional dengan menggunakan brosur, banner dan spanduk. Hal ini dinilai kurang efektif, efisien, dan fleksibel jika masih dilakukan di SMPN 27 Seluma. Oleh karena itu, penelitian ini bertujuan untuk mengembangkan sistem informasi profil dan PPDB online yang berbasis website yang ada di SMPN 27 Seluma. Pengembangan sistem informasi profil dan PPDB online berbasis web digunakan metode waterfall. Berdasarkan hasil pengembangan dan implementasi sistem informasi profil dan PPDB online berbasis website, didapatkan sistem berhasil meningkatkan efektivitas, efisiensi, dan fleksibilitas dalam proses PPDB dan penyebaran informasi di SMPN 27 Seluma. Hasil pengujian usability dengan menggunakan USE Questionnaire mendapatkan hasil persentase pengujian untuk responden sebesar 88,46%. Dapat disimpulkan dari hasil pengujian usability menggunakan kuesioner USE Questionnaire menunjukkan bahwa sistem informasi profil dan PPDB online SMPN 27 Seluma yang dibuat tersebut sudah sangat layak.",9
686,Rancang Bangun Sistem Inforrmasi Akademik Berbasis Website Menggunakan Metode Modified Waterfall (Studi Kasus : SMK Negeri 1 Muara),rancang bangun sistem inforrmasi akademik berbasis website menggunakan metode modified waterfall studi kasus smk negeri 1 muara,Teknik Informatika,2024,Satrio Maruli Jaya Sianturi,"Eko Dwi Nugroho, S.Kom., M.Cs.",https://repo.itera.ac.id/depan/submission/SB2406100175,"Penelitian ini mencoba membantu dalam menyelesaikan permasalahan dalam ranah pendidikan yang terkait dengan kemajuan berkembang pesatnya teknologi dalam informasi akademik. Pada SMK Negeri 1 Muara yang menjadi studi kasus penelitian ini, dimana proses dalam sistem informasi di sekolah tersebut masih secara manual dalam pengolahan presensi siswa, jadwal pelajaran, penilaian siswa. Untuk mengatasi permasalahan ini, sistem informasi akademik berbasis website berhasil dikembangkan dengan menggunakan metode modified waterfall. Dengan adanya sistem ini dapat memudahkan pekerjaan guru maupun admin dalam pengelolaan presensi siswa, penjadwalan, penilaian dan aspek lainya. Pengujian Black Box Testing yang dilakukan oleh SMK Negeri 1 Muara menunjukkan bahwa sitem yang sudah dikembangankan memenuhi kebutuhan pengguna. Selain itu , evaluasi usability dengan menggunakan System Usability Scale (SUS) menunjukkan bahwa pengguna sistem informasi akademik , termasuk admin, guru, dan siswa, memberikan skor nilai sebesar 90, yang mencapai kategori grade A atau Best Imaginable. Yang menunjukkna bahwa sistem informasi tersebut diterima dengan baik oleh pihak sekolah. Dengan demikian, penelitian ini berhasil mengatasi permasalahan di SMK Negeri 1 Muara. Ini menjadi saran yang baik dalam menanggapi kemajuan teknologi informasi di sektor pendidikan.",9
688,RANCANG BANGUN SISTEM INVENTORI SARANA DAN PRASARANA SEKOLAH MENGGUNAKAN METODE SDLC MODIFIED WATERFALL BERBASIS WEB (STUDI KASUS: SMA YADIKA SOREANG),rancang bangun sistem inventori sarana dan prasarana sekolah menggunakan metode sdlc modified waterfall berbasis web studi kasus sma yadika soreang,Teknik Informatika,2023,Aris Ilham Nugraha,"Aidil Afriansyah, S.Kom., M.Kom.",https://repo.itera.ac.id/depan/submission/SB2310050002,"RANCANG BANGUN SISTEM INVENTORI SARANA DAN PRASARANA SEKOLAH MENGGUNAKAN METODE SDLC MODIFIED WATERFALL BERBASIS WEB (STUDI KASUS: SMA YADIKA SOREANG) SMA Yadika Soreang memiliki banyak fasilitas sarana dan prasarana untuk penunjang pembelajaran. Pencatatan sarana dan prasarana dari fasilitas yang sudah ada tetapi dalam pencatatan tersebut masih tidak terkendali dalam penanggung jawabnya serta dalam ketersediaan barangnya disana menggunakan manual sehingga rentan hilang dang rusak oleh peminjam yang tidak bertanggungjawab. Perancangan sistem inventori sarana dan prasarana sekolah dengan metode SDLC (System Development Life Cycle) model waterfall dapat membantu dalam proses pengontrolan yang lebih mudah dan terdata dengan baik. Hasil yang didapatkan yaitu penggunaan metode waterfall pada penelitian ini berhasil merancang sistem inventory sarana dan prasarana sekolah berbasis website. Hal itu dibuktikan semua pengujian fungsionalitas dinyatakan berhasil. Sistem yang dibangun sudah terintegrasikan dengan riwayat. Hal itu dibuktikan dengan adanya fitur history pada admin. Selanjutnya, berdasarkan hasil dari pengujian Blackbox yang berjumlah 27 fungsi bahwa sistem dinyatakan berhasil dan sesuai rencana. Hasil dari pengujian System Usability Scale (SUS) didapatkan responden siswa terhadap sistem ini ditingkat rata-rata skor 86 atau berada direntang 85-100 dengan keterangan best imaginable, yang berarti sistem diterima oleh responden siswa. Responden guru dan admin didapatkan nilai rata-rata skor 83 atau berada direntang 70-85 dengan keterangan excellent, yang berarti diterima oleh responden guru dan admin. Kata kunci: Black Box, System Development Life Cycle, System Usablity Scale, Waterfall.",9
731,Sistem Informasi Akademik Sekolah Menggunakan Metode Pengembangan Waterfall,sistem informasi akademik sekolah menggunakan metode pengembangan waterfall,Teknik Informatika,2023,Faizal Alif,"Mugi Prasetiawan, S.T., M.Kom.",https://repo.itera.ac.id/depan/submission/SB2305220001,"Kendala utama yang dihadapi oleh SMK N 1 Sekampung adalah proses pengolahan rapor yang lambat dan sering terjadinya kehilangan lembar kertas saat melakukan rekapitulasi nilai. Hal ini disebabkan oleh pengolahan rapor yang dilakukan secara konvensional. Untuk memecahkan masalah tersebut, dilakukan perencanaan pembangunan sistem informasi akademik terintegrasi dengan berbasis website menggunakan metode Waterfall. Setelah berhasil dikembangkan, dilakukan uji fungsionalitas (blackbox testing) dan uji kelayakan sistem (usability testing) untuk mengetahui kesesuaian dengan kebutuhan SMK N 1 Sekampung. Solusi ini dikembangkan berdasarkan hasil angket pra-penelitian dan wawancara dengan Waka Kurikulum SMK N 1 Sekampung. Sistem informasi akademik berhasil dikembangkan dan diintegrasikan dengan kebutuhan pengolahan rapor di SMK N 1 Sekampung, berkat peran aktif Waka Kurikulum. Hasil pengujian fungsionalitas menunjukkan bahwa sistem ini sesuai dengan harapan pada tahap perancangan, sedangkan pengujian kelayakan sistem menunjukkan bahwa sistem ini sangat layak dengan persentase keseluruhan sebesar 76,67%. Meskipun begitu, sistem informasi akademik SMK N 1 Sekampung masih terdapat ruang untuk perbaikan di masa depan.",9
736,SISTEM INFORMASI GEOGRAFIS PEMETAAN SEKOLAH MENENGAH ATAS (SMA) DI KOTA BANDAR LAMPUNG MENGGUNAKAN METODE EXTREME PROGRAMMING,sistem informasi geografis pemetaan sekolah menengah atas sma di kota bandar lampung menggunakan metode extreme programming,Teknik Informatika,2025,Muhammad Faiz Ramadhan,"Eko Dwi Nugroho, S.Kom., M.Cs.",https://repo.itera.ac.id/depan/submission/SB2510230016,"Pendidikan merupakan faktor penting dalam kemajuan suatu negara, namun pada beberapa daerah penyebaran pendidikan masih belum merata sehingga masyarakat kesulitan mengetahui lokasi dan informasi sekolah. Berdasarkan survei, 87,6% responden menyatakan kebutuhan akan Sistem Informasi Geografis (SIG) pemetaan sekolah SMA di Kota Bandar Lampung. Penelitian ini bertujuan membangun aplikasi SIG berbasis web untuk memudahkan pencarian informasi sekolah SMA di Bandar Lampung. Pengembangan menggunakan metode Extreme Programming dan memanfaatkan Leaflet untuk menampilkan peta persebaran sekolah. Hasil pengujian Black Box Testing menunjukkan sistem berjalan dengan baik, sedangkan uji System Usability Scale memperoleh skor 86,23 (kategori sangat baik, grade B, “Excellent”). Dengan demikian, sistem yang dibangun layak digunakan meskipun terdapat kendala dalam ketepatan waktu pengembangan akibat permasalahan teknis dan manajemen.",9
741,SISTEM INFORMASI MANAJEMEN PERPUSTAKAAN MENGGUNAKAN METODE WATERFALL PADA SMA NEGERI 1 TRIMURJO,sistem informasi manajemen perpustakaan menggunakan metode waterfall pada sma negeri 1 trimurjo,Teknik Informatika,2024,Ellya Rosanti,"Andre Febrianto, S.Kom., M.Eng",https://repo.itera.ac.id/depan/submission/SB2402150003,"Pemanfaatan website di Indonesia juga sering digunakan dalam sektor pendidikan, salah satu sektor pendidikan yang menggunakan website adalah SMA Negeri 1 Trimurjo, yang menggunakan website untuk menyebarkan informasi terkait profil sekolah dan keunggulan lain yang dimiliki oleh sekolah SMA Negeri 1 Trimurjo. Manajemen perpustakaan yang ada pada SMA Negeri 1 Trimurjo masih dilakukan secara manual, sehingga hal tersebut sering menjadikan petugas perpustakaan mengalami kekeliruan dalam melakukan pencatatan dan sering terjadi kehilangan buku ketika anggota perpustakaan sudah lama tidak mengembalikan buku yang telah dipinjam. Berdasarkan permasalahan tersebut peneliti membuat sistem informasi manajemen perpustakaan yang dapat meningkatkan efiesiensi serta efektifitas petugas perpustakaan dalam melakukan peminjaman serta pengembalian buku. Pengembangannya menggunakan metode waterfall, serta menggunakan bahasa pemrograman PHP dan menggunakan framework laravel, dan pengujian sistem menggunakan metode SUS dan metode black box. Hasil perhitungan dari 30 responden didapatkan jumlah nilai sebesar maka 2590 nilai rata- rata atau SUS Score yang didapat adalah 86,3333. Berdasarkan pengujian tersebut dapat dikatakan Acceptability Ranges termasuk Acceptable, Grade Scale termasuk Skala A, dan Adjective Ratings termasuk Best Imaginable. Hasil pengujian fungsional menggunakan black box testing menunjukan bahwa sistem dapat bekerja 100% tanpa ada nya bug yang ditemukan pada sistem.",9
759,SISTEM PEMANTAUAN BAYI SECARA JARAK JAUH BERUPA AYUNAN BAYI MENGGUNAKAN ESP32 BERBASIS INTERNET OF THINGS (IoT),sistem pemantauan bayi secara jarak jauh berupa ayunan bayi menggunakan esp32 berbasis internet of things iot,Teknik Informatika,2021,Ayu Rahmawati,"Martin C.T. Manullang, S.T., M.T.",https://repo.itera.ac.id/depan/submission/SB2106100044,"Anak merupakan anugerah yang sangat membahagiakan bagi suatu keluarga. Ketika sang Ayah sedang pergi bekerja, maka Ibu lah yang harus menjaga anaknya. Akan tetapi, selain menjaga anak, Ibu juga memiliki kegiatan lain yang juga tidak dapat ditinggalkan apabila tidak memiliki asisten rumah tangga seperti memasak, mencuci, dan lain sebagainya, kegiatan tersebut membuat sang Ibu tidak dapat memantau anaknya secara langsung setiap saat. Sehingga dirancanglah sistem yang dapat mempermudah pekerjaan ibu dalam menjaga anak. Sistem yang akan dirancang yaitu ayunan bayi yang berbasiskan Internet of Things (IoT) dan akan terhubung dengan aplikasi mobile. Sistem ini dapat memantau bayi secara waktu nyata, dapat menggerakan ayunan dan mainan gantung bayi melalui aplikasi mobile, dan dapat mendeteksi kelembapan tempat tidur bayi menggunakan sensor kelembapan yang telah terhubung dengan aplikasi mobile. Pada pengujian reability, aplikasi memiliki rata – rata delay yang tidak melebihi batas dari rancangan yang telah dibuat, yaitu 10 detik. Rata -rata delay yang terjadi pada sistem yaitu sebesar 1,57 hingga 3,06 detik. Pada pengujian fungsionalitas, keseluruhan fungsi dinyatakan berhasil dalam pengujian, sedangkan pada pengujian usability, didapatkan hasil dari indeks penilaian sebesar 93,75% hasil tersebut menandakan bahwa sistem dapat bekerja dengan baik. Kata Kunci : Anak, Ayunan bayi, pemantauan, Internet of Things, Aplikasi mobile.",9
