id,title,clean_title,category,year,author,advisor,url,abstract,cluster
527,PERBANDINGAN LEMMATIZATION DAN STEMMING PADA PENILAIAN ESAI SINGKAT BERBAHASA INGGRIS MENGGUNAKAN TF-IDF DAN COSINE SIMILARITY,perbandingan lemmatization dan stemming pada penilaian esai singkat berbahasa inggris menggunakan tf idf dan cosine similarity,Teknik Informatika,2023,Aprilia Purwanto,"Winda Yulita, S.Pd., M.Cs.",https://repo.itera.ac.id/depan/submission/SB2305030001,"Di dunia pendidikan, dibutuhkan suatu evaluator otomatis untuk mengevaluasi soal esai agar penilaian konsisten dan cepat. Dalam proses pengembangannya, dapat digunakan 2 tahapan text-preprocessing yaitu lemmatization dan stemming. Belum banyak penelitian yang membandingkan kedua tahapan ini. Oleh sebab itu, tujuan penelitian ini adalah untuk mengetahui perbandingan tingkat akurasi penilaian esai singkat otomatis berbahasa Inggris menggunakan metode TF-IDF dan cosine similarity dengan penerapan proses lemmatization dan dengan penerapan proses stemming. Tahapan penelitian yaitu menyiapkan dataset berupa dokumen jawaban, dokumen kunci jawaban, serta nilai evaluasi manusia, Spelling correction, Case Folding, Tokenizing, Stopword Removal, Stemming, POS Tagging, Lemmatization. TF-IDF, Cosine Similarity, Scoring, dan Mean Absolute Error. Hasil penelitian menunjukkan nilai Mean Absolute Error (MAE) dari model yang menerapkan proses lemmatization sebesar 2,674 sedangkan untuk model yang menerapkan proses stemming mendapatkan nilai MAE yang sebesar 2,625. Dapat disimpulkan bahwa performa model dengan proses stemming lebih baik dibandingkan dengan model dengan proses lemmatization.",16
530,Perbandingan Metode Cosine Similarity TF-IDF dengan Jaccard Similarity untuk Penilaian Esai Bahasa Inggris Otomatis,perbandingan metode cosine similarity tf idf dengan jaccard similarity untuk penilaian esai bahasa inggris otomatis,Teknik Informatika,2023,Ahmad Alif Sofian,"Winda Yulita, M.Cs.",https://repo.itera.ac.id/depan/submission/SB2305310008,"Terdapat beberapa metode dalam penilaian yaitu pilihan ganda, uraian singkat, dan esai. Metode penilaian esai dikatakan baik dalam mengevaluasi kemampuan siswa dibandingkan dengan metode lainnya. Namun, metode penilaian esai cukup rumit untuk dilakukan penilaian. Salah satu penggunaan teknologi yang dapat membantu menyelesaikan permasalah penilaian esai adalah Automated essay scoring (AES). Beberapa metode yang dapat diterapkan pada AES adalah metode Cosine Similarity dengan pembobotan kata TF-IDF dan Jaccard Similarity. Berdasarkan beberapa penelitian terdahulu, kedua metode tersebut memiliki tingkat akurasi yang baik, namun belum ada perbandingan dengan dataset yang sama pada kasus AES. Penelitian ini memiliki tujuan untuk membandingkan tingkat akurasi metode Cosine similarity menggunakan pembobotan kata TF-IDF dengan metode Jaccard Similarity pada penilaian esai bahasa inggris otomatis. Berdasarkan hasil pengujian Metode Cosine Similarity TF-IDF memiliki akurasi yang lebih baik jika dibandingkan dengan metode Jaccard Similarity. Akurasi tertinggi didapatkan dari pengujian skenario 1 pada metode Cosine Similarity TF-IDF adalah 90,372",16
534,PERBANDINGAN METODE JACCARD SIMILARITY DENGAN COSINE SIMILARITY PADA TF-IDF UNTUK MODEL REKOMENDASI BERITA (Studi Kasus : Berita Radar Lampung Online),perbandingan metode jaccard similarity dengan cosine similarity pada tf idf untuk model rekomendasi berita studi kasus berita radar lampung online,Teknik Informatika,2023,Randi Baraku,"Winda Yulita, M.Cs.",https://repo.itera.ac.id/depan/submission/SB2305080007,"Kemajuan teknologi menyebabkan perkembangan pada berbaga bidang, salah satunya adalah perusahaan media. Dalam rangka mempertahankan pembaca, perusahaan media berupaya untuk menyediakan berita yang relevan dan sesuai dengan pembaca, salah satunya melalui sistem rekomendasi. sistem rekomendasi dapat ditempuh melalui berbagai metode pendekatan, Cosine dan Jaccard merupakan beberapa diantaranya. Kendati demikian kedua metode ini memiliki kontradiksi satu sama lain dimana salah satunya merupakan metode terbaik untuk membangun model rekomendasi berita. Penelitian ini akan berfokus membandingakan kedua metode tersebut dan mengetahui tingkat akurasi kedua metode bersadarkan evaluasi MAE dan RMSE. Hasil yang diperoleh adalah metode Cosine lebih baik dari metode Jaccard dengan nilai MAE sebesar 0.26 dan nilai RMSE sebesar 0.46, sedangkan Jaccard memperoleh nilai MAE sebesar 0.61 dan nilai RMSE sebesar 1.05. Hasil ini disebabkan oleh metode pembobotan yang berlaku pada kedua metode sehingga mempengaruhi tingkat akurasi.",16
546,PERBANDINGAN METODE PEMBOBOTAN KATA TF-IDF DENGAN TF-RF PADA PERINGKASAN TEKS BERITA OTOMATIS DENGAN METODE MAXIMUM MARGINAL RELEVANCE,perbandingan metode pembobotan kata tf idf dengan tf rf pada peringkasan teks berita otomatis dengan metode maximum marginal relevance,Teknik Informatika,2023,Joddy Sebastian Siregar,"Winda Yulita, M.Sc",https://repo.itera.ac.id/depan/submission/SB2305310009,"Dalam perkembangan teknologi dan informasi yang cepat saat ini, banyak pengguna internet yang menggunakan internet untuk memperbarui informasi, sekitar 25,3",16
552,Perbandingan Metode Stopword Removal dan Part-of-Speech Tagging Pada Penilaian Essay Otomatis Menggunakan Mean Absolute Error,perbandingan metode stopword removal dan part of speech tagging pada penilaian essay otomatis menggunakan mean absolute error,Teknik Informatika,2023,Nesa Oktavia,"Meida Cahyo Untoro, S.Kom., M.Kom.",https://repo.itera.ac.id/depan/submission/SB2308040044,"Penelitian ini dilatarbelakangi oleh sistem penilaian essay manual yang memiliki kelemahan yaitu membutuhkan banyak waktu, tenaga dan biaya, karena memiliki berbagai jenis jawaban. Oleh karena itu dilakukan penelitian dengan tujuan untuk membangun sistem penilaian essay otomatis menggunakan dua metode, yaitu metode stopword dan POS tagging. Pada evaluasi penilaian essay dilakukan dengan menghitung Mean Absolute Error (MAE). Lalu kedua metode dibandingkan, sehingga didapat metode yang memiliki tingkat akurasi yang lebih baik. Metode stopword merupakan proses penghilangan stopword yaitu kata - kata yang sering kali muncul dalam dokumen namun arti dari kata-kata tersebut tidak deskriptif dan tidak memiliki keterkaitan dengan tema tertentu. Metode Part-of-Speech (POS) tagging adalah proses mendeteksi struktur kalimat dengan memberikan label kelas kata untuk mengelompokan setiap kata berdasarkan role dari masing-masing kata dalam suatu kalimat. Hasil penelitian menunjukkan bahwa penilaian dengan metode POS tagging lebih baik dibandingan dengan menggunakan metode stopword removal. Hasil dari uji coba yang dilakukan menghasilkan nilai rata-rata MAE pada metode stopword removal sebesar 0.29608792567384623 dan pada metode POS tagging sebesar 0.2474349799912565. Hal ini disebabkan pada metode stopword removal banyak menghilangkan kata yang penting. Kata penting atau kata konten adalah kata benda, kata kerja, kata sifat dan kata keterangan yang mengandung sebagian besar referential (atau makna kognitif) dari sebuah kalimat. Sedangkan pada metode POS tagging tidak, hal ini karena pada metode ini mempertimbangkan kelas kata dalam suatu kalimat. Oleh karena itu, banyaknya kata hasil preprocessing sangat mempengaruhi hasil penilaian. Kata Kunci : Stopword, POS tagging, MAE, preprocessing, essay",16
556,PERBANDINGAN MODEL IndoROBERTa-CNN-LSTM DAN IndoROBERTa-CNN-GRU UNTUK ANALISIS SENTIMEN MAKAN BERGIZI GRATIS DI MEDIA SOSIAL X,perbandingan model indoroberta cnn lstm dan indoroberta cnn gru untuk analisis sentimen makan bergizi gratis di media sosial x,Teknik Informatika,2025,M. RIZKI ALFAINA,"Andika Setiawan, S.Kom., M.Cs.",https://repo.itera.ac.id/depan/submission/SB2507280003,"Program Makan Bergizi Gratis (MBG), yang diprakarsai oleh Presiden Prabowo Subianto dan Wakil Presiden Gibran Rakabuming Raka sebagai bagian dari upaya mewujudkan Visi Indonesia Emas 2045 telah menjadi topik diskusi yang signifikan di media sosial X dan menghasilkan beragam opini publik. Analisis sentimen yang akurat diperlukan untuk memahami persepsi masyarakat terhadap kebijakan ini. Penelitian ini membandingkan kinerja model deep learning hibrida, IndoROBERTa-CNN-LSTM dan IndoROBERTa-CNN-GRU, untuk menganalisis sentimen publik terhadap program ""Makan Bergizi Gratis"" (MBG) di media sosial X. Menggunakan 11.057 data tweet yang telah melalui preprocessing dan penyeimbangan kelas dengan SMOTE, kedua model dievaluasi melalui validasi silang 5-fold. Hasil menunjukkan model IndoROBERTa-CNN-LSTM unggul dengan akurasi 79,11% dibandingkan IndoROBERTa-CNN-GRU (78,75%). Analisis menemukan bahwa sentimen publik didominasi oleh opini negatif, dan kedua model kesulitan mengklasifikasikan kelas netral yang ambigu. Disimpulkan bahwa arsitektur LSTM lebih akurat, namun arsitektur GRU lebih efisien secara komputasi.",16
559,PERBANDINGAN PEMBOBOTAN KATA METODE TF-IDF DENGAN TF-ABS PADA PERINGKASAN TEKS BERITA OTOMATIS MENGGUNAKAN MAXIMUM MARGINAL RELEVANCE,perbandingan pembobotan kata metode tf idf dengan tf abs pada peringkasan teks berita otomatis menggunakan maximum marginal relevance,Teknik Informatika,2023,Intan Wulandari Br Siregar,"Winda Yulita, M.Cs.",https://repo.itera.ac.id/depan/submission/SB2307220002,"Seiring perkembangan teknologi informasi menyebabkan teknologi internet semakin cepat, sehingga memicu munculnya banyak situs berita online. Meningkatnya jumlah portal berita online menimbulkan banyaknya berita yang disuguhkan kepada masyarakat, sehingga kebutuhan peringkasan teks semakin dibutuhkan agar dapat memperoleh informasi secara cepat. Oleh sebab itu, dibutuhkan sebuah sistem peringkasan teks berita dengan metode Maximum Marginal Relevance untuk mendapatkan hasil ringkasan. Tujuan penelitian dengan membandingkan nilai akurasi antara algoritma TF-IDF dan TF-ABS adalah untuk mengetahui pembobotan kata dengan nilai akurasi yang lebih tinggi diantara kedua algoritma tersebut. Proses peringkasan dimulai dari tahapan preprocessing yang berisi segmentasi kalimat, case folding, tokenizing, filtering dan stemming lalu dilanjutkan dengan pembobotan TF-IDF dan TF-ABS untuk menentukan nilai bobot kata dan membandingkan pembobotan kata untuk mendapatkan hasil ringkasan menggunakan Maximum Marginal Relevance. Hasil penelitian ini menunjukkan bahwa pembobotan kata TF-ABS mendapatkan nilai akurasi lebih tinggi dibandingkan TF-IDF. Dengan nilai rata-rata precision sebesar 0.34408, recall sebesar 0.29984, dan f-measure sebesar 0.31478. Sedangkan pada pengujian TF-ABS menghasilkan nilai rata-rata precision sebesar 0.35426, recall sebesar 0.31014, dan f-measure sebesar 0.32788.",16
569,PERINGKASAN TEKS BERITA OTOMATIS DENGAN METODE MAXIMUM MARGINAL RELEVANCE (MMR) DENGAN PENERAPAN PART-OF-SPEECH (POS) TAGGING,peringkasan teks berita otomatis dengan metode maximum marginal relevance mmr dengan penerapan part of speech pos tagging,Teknik Informatika,2025,HAMIDAH FIROOS,"Winda Yulita, M.Cs.",https://repo.itera.ac.id/depan/submission/SB2505230032,"Penggunaan internet membuat akses berita menjadi jauh lebih mudah sehingga menyebabkan ledakan informasi yang menuntut informasi tersebut untuk dibaca dengan cepat dengan waktu seminimal mungkin. Sehingga perlu suatu model peringkasan teks otomatis pada berita berbahasa Indonesia untuk mempermudah pembaca mendapatkan informasi yang diperlukan dengan cepat. Penelitian ini memanfaatkan Maximum Marginal Relevance (MMR), sebuah metode peringkasan ekstraktif yang unggul terkait dengan efisiensi, kesederhanaan, dan kemampuannya dalam meminimalkan pengulangan informasi. Hasil ringkasan yang disajikan minim redundansi dan strukturnya menyerupai abstrak makalah. Namun metode ini belum dapat mengatasi masalah ambiguitas atau kata yang memiliki makna ganda. Oleh karena itu, pada penelitian ini diterapkan juga Part-of-Speech (POS) Tagging untuk mengatasi hal tersebut. Setelah melakukan penelitian Peringkasan Teks Berita Otomatis Menggunakan Metode MMR dengan Penerapan POS Tagging untuk 100 teks berita berbahasa Indonesia dengan tiga jenis panjang hasil ringkasan (10%, 20%, dan 30%) dan dievaluasi menggunakan precision, recall, dan f-measure didapatkan hasil: untuk panjang 10% secara beruntun adalah 0.65, 0.58, dan 0.60; untuk panjang 20",16
570,Peringkasan Teks Berita Otomatis Menggunakan Metode Latent Semantic Analysis (LSA) dan Metode Pembobotan TF-IDF-DF,peringkasan teks berita otomatis menggunakan metode latent semantic analysis lsa dan metode pembobotan tf idf df,Teknik Informatika,2022,Firman Oloan Manalu,"Andika Setiawan S.Kom., M.Cs.",https://repo.itera.ac.id/depan/submission/SB2208100014,"Pada perkembangan era teknologi saat ini, semakin banyak informasi berita pada berbagai situs media online yang disajikan dalam bentuk dokumen. Banyaknya informasi yang tersedia di dalam dokumen membuat pembaca membutuhkan waktu yang lama dan relatif sulit untuk dapat memahami inti dari berita tersebut. Peringkasan teks otomatis merupakan proses menghasilkan ringkasan teks dengan versi yang lebih singkat tanpa menghilangkan pokok pikiran dari teks asli. Salah satu metode peringkasan teks otomatis yaitu Latent Semantic Analysis (LSA) merupakan suatu metode untuk mengekstrak struktur semantik atau menganalisis makna yang masih tersembunyi pada sebuah kalimat. Beberapa tahapan pada LSA yaitu pembobotan kata, Singular Value Decomposition (SVD), dan menghitung nilai length pada matriks yang didapatkan dari metode SVD. Pengujian pada penelitian ini membandingkan tingkat performansi dengan menggunakan dua pembobotan kata yang berbeda, yaitu TF-IDF dan TF-IDF-DF. Hasil pengujian terhadap 50 dokumen diperoleh nilai rata-rata precision, recall, dan f-measure terbaik dengan menggunakan pembobotan TF-IDF-DF. Nilai precision terbaik dihasilkan pada compression rate 10",16
726,SENTIMEN ANALISIS PADA MEDIA SOSIAL TWITTER TERHADAP LAYANAN BANTUAN TOKOPEDIA MENGGUNAKAN METODE NAÏVE BAYES CLASSIFIER,sentimen analisis pada media sosial twitter terhadap layanan bantuan tokopedia menggunakan metode na ve bayes classifier,Teknik Informatika,2022,Muhammad Iqbal,"Meida Cahyo Untoro, S.Kom., M.T.",https://repo.itera.ac.id/depan/submission/SB2206100003,"Sosial media yakni alat untuk konsumen sebagai sarana sharing teks, video dan audio. Salah satu media sosial yang marak dikalangan pengguna adalah Twitter. Twitter ialah situs microblogging yang memungkinkan penggunanya untuk menulis tentang berbagai isu-isu yang sedang terjadi. Dalam hal ini, penulis mengaplikasikan proses text mining, preprocessing untuk seleksi fitur dan menggunakan metode Naive Bayes classifier untuk mengklasifikasi sentimen dengan menggunakan data tweet dari akun @tokopedia. Pada penelitian kali ini, data yang digunakan adalah data tweet pengguna twitter dari bulan November 2019 sampai bulan Desember 2019. Didapatkan sebanyak 8420 data, kemudian data tersebut dipisahkan dari duplikasi data sehingga didapatkan 1000 data yang digunakan untuk proses klasifikasi.Proses klasifikasi menggunakan metode naive bayes classifier dengan membandingkan algoritma multinomial naive bayes, gaussian naive bayes dan bernoulli naive bayes yang terdapat pada naive bayes classifier. Proses klasifikasi menghasilkan 65% akurasi menggunakan multinomial naive bayes, 53% akurasi menggunakan gaussian naive bayes dan 63% akurasi menggunakan bernoulli naive bayes. Kata kunci : Sosial media, Twitter, sentimen analisis, Naive Bayes classifier, text mining, naïve bayes, multinomial naive bayes, gaussian naive bayes, bernoulli naive bayes",16
